{"bindings":{"key_sha256":"66e7c82b49bb291dd09c8e020448311c4a7bb96aeb5c5db769f66812b13a50b5","observed_state":"not_started","operation":"update","precondition_sha256":"7f6496c2d54a50a9e43da30bb3f03a9a750cfffc586644e92508f095ed0811c4","replay_class":"external_idempotent","reported_state":"unknown","request_sha256":"0bd4eb5cf3393daa35f5a1f6a1878da05df7b47a52f67896b52070a2210e4a72","scope_sha256":"03b512b67ffba5e79f7b2ba28514374b7f7fd9d416f0a7c2e8797eb798380551","target_sha256":"b44d0cd8336a21e52ace1d2c1ea8b30db8ab7febec342c0751663a7d4aebed29","transaction_sha256":"8cdf6ba5a1c1ab68db3859b35ffc9b484cf1e84539a346d142696559ba32a088"},"evidence_ref":"sha256:43c34dddfda18b8bea472f6a1f33950389fe75098fa20a683defeace42f1b1a2","issuer":"git-local","profile":{"id":"workcell.git-cas","version":"1beta1"},"profile_sha256":"5a549788f920d58caf1731c3f9635965ac2d7a0c5fd689061ae9e2fcfdac0dbf","schema":"dispatch.effect-assurance/v1beta1","subject":{"attempt_id":"1","effect_id":"effect-1","kind":"action","result_sha256":"28186b9763c0ec35d98bec517bce0802a4b7115bc348080e1204531808f6e1ef","run_id":"run-1790550478607-8196","step_id":"action"},"validity":{"from":1790550472,"until":1790552277},"verification_method":"live_readback"}