{"bindings":{"key_sha256":"2aa0028f02431b7d8c6af5bb1d1cf93fb3608e02a802b8b9705f0154b513cd55","observed_state":"committed","operation":"create","precondition_sha256":"b8c1ded1a03c59f9bf3fde0d4f5d5b9ce1ff02d9cd76eceb655f7eaeeae6ac25","replay_class":"external_idempotent","reported_state":"unknown","request_sha256":"4dd93b028cfa61053f3f91d75331178d364295d4dd9e24459180ea4ca2b3bdc5","scope_sha256":"a585a9ffff467db453d7500dd466ff301c7476faa917ebbc2324fb1feb337202","target_sha256":"e76cee3b126634393b3a972c4ac277f8354bed0241a7590a3800fa12f43ff47f","transaction_sha256":"296edc3179e499d7e64d3322b12ca86ffe1f4cbea311fd5055792b70d0d4a38e"},"evidence_ref":"sha256:4312919f066009a1cfd9b167099678c36c49d7cbac8cbc0d045c195283981d53","issuer":"ability-local","profile":{"id":"ability.application-gateway","version":"1beta1"},"profile_sha256":"d1a7dddd5ce27de76c99033b6e851a5bfc529813c4dc00ea6022652794c83ea4","schema":"dispatch.effect-assurance/v1beta1","subject":{"attempt_id":"1","effect_id":"effect-1","kind":"action","result_sha256":"d5c79a83a679169f161e198181fc203f79f049e46546896987b0b9850326ba15","run_id":"run-1790540406307-4725","step_id":"action"},"validity":{"from":1790540403,"until":1790542205},"verification_method":"live_readback"}