{"bindings":{"key_sha256":"66e7c82b49bb291dd09c8e020448311c4a7bb96aeb5c5db769f66812b13a50b5","observed_state":"committed","operation":"update","precondition_sha256":"7f6496c2d54a50a9e43da30bb3f03a9a750cfffc586644e92508f095ed0811c4","replay_class":"external_idempotent","reported_state":"unknown","request_sha256":"0bd4eb5cf3393daa35f5a1f6a1878da05df7b47a52f67896b52070a2210e4a72","scope_sha256":"03b512b67ffba5e79f7b2ba28514374b7f7fd9d416f0a7c2e8797eb798380551","target_sha256":"b44d0cd8336a21e52ace1d2c1ea8b30db8ab7febec342c0751663a7d4aebed29","transaction_sha256":"411d5fbcbaa4c6fb5b441148071a41d17168caaaf27d87df0e288e5d3c953096"},"evidence_ref":"sha256:f6b6f9771af6970b3bd36e1611a7fb2044d1ab7f725f5efdc7eca1b8dc9c1dd3","issuer":"git-local","profile":{"id":"workcell.git-cas","version":"1beta1"},"profile_sha256":"e9154a420ae6d9b269795355d74ce4688eae3e1b0d9120d62e020cdcb7e2d297","schema":"dispatch.effect-assurance/v1beta1","subject":{"attempt_id":"1","effect_id":"effect-1","kind":"action","result_sha256":"f244d8269e60a65bb6ee29a32103b82a7cdab56f393f20b055c142d22b784add","run_id":"run-1790550443166-7381","step_id":"action"},"validity":{"from":1790550437,"until":1790552242},"verification_method":"live_readback"}