{"bindings":{"key_sha256":"66e7c82b49bb291dd09c8e020448311c4a7bb96aeb5c5db769f66812b13a50b5","observed_state":"committed","operation":"update","precondition_sha256":"7f6496c2d54a50a9e43da30bb3f03a9a750cfffc586644e92508f095ed0811c4","replay_class":"external_idempotent","reported_state":"unknown","request_sha256":"7ee5525debe0a643f4e43ba36c43e74cd965cff6363c8f994674c9a4f2db7a06","scope_sha256":"03b512b67ffba5e79f7b2ba28514374b7f7fd9d416f0a7c2e8797eb798380551","target_sha256":"1dd328912f177d086522657f8c4a48baf0ded4acef74ee979fdb261b11b7db30","transaction_sha256":"433dfb8cd1caf36fee00a93f151f29564acd361a939748fcaed3bcdaaef3d47f"},"evidence_ref":"sha256:c006fdc5930666a40e1fc7b31b1380300778c78ace8dc6a58c65f37a41b9977a","issuer":"git-local","profile":{"id":"workcell.git-cas","version":"1beta1"},"profile_sha256":"0ed4500b88c6ec14cec5fa245e35c2165b7309772780c753253645e9ea3ae7a0","schema":"dispatch.effect-assurance/v1beta1","subject":{"attempt_id":"1","effect_id":"effect-1","kind":"action","result_sha256":"55a406bf46951aa7107c23e58b1fab5e4072f0a1310f7b87986356a703dd7601","run_id":"run-1790540223330-4617","step_id":"action"},"validity":{"from":1790540217,"until":1790542022},"verification_method":"live_readback"}