{"bindings":{"key_sha256":"66e7c82b49bb291dd09c8e020448311c4a7bb96aeb5c5db769f66812b13a50b5","observed_state":"committed","operation":"update","precondition_sha256":"7f6496c2d54a50a9e43da30bb3f03a9a750cfffc586644e92508f095ed0811c4","replay_class":"external_idempotent","reported_state":"unknown","request_sha256":"0bd4eb5cf3393daa35f5a1f6a1878da05df7b47a52f67896b52070a2210e4a72","scope_sha256":"03b512b67ffba5e79f7b2ba28514374b7f7fd9d416f0a7c2e8797eb798380551","target_sha256":"b44d0cd8336a21e52ace1d2c1ea8b30db8ab7febec342c0751663a7d4aebed29","transaction_sha256":"acf9c3ca1d551e091c14938b9610d03d1848b922e0a04dfb19c2a51660196f55"},"evidence_ref":"sha256:ff233cb895a55bbf9dce669e6a6d2ac97884754e1164a8ee36310f8da99b4b6a","issuer":"git-local","profile":{"id":"workcell.git-cas","version":"1beta1"},"profile_sha256":"ea1d78d41abe715790c07999c9c7879bd1dcbfb75b7d744f5380a48145905276","schema":"dispatch.effect-assurance/v1beta1","subject":{"attempt_id":"1","effect_id":"effect-1","kind":"action","result_sha256":"a836a92f315971ba8338136487dbcee3381d10c4975ec3ba43d8d4b51cfcda12","run_id":"run-1790561610264-6724","step_id":"action"},"validity":{"from":1790561604,"until":1790563409},"verification_method":"live_readback"}