{"bindings":{"key_sha256":"66e7c82b49bb291dd09c8e020448311c4a7bb96aeb5c5db769f66812b13a50b5","observed_state":"committed","operation":"update","precondition_sha256":"7f6496c2d54a50a9e43da30bb3f03a9a750cfffc586644e92508f095ed0811c4","replay_class":"external_idempotent","reported_state":"unknown","request_sha256":"844fb8b97fba8184c639c9afbbbafcc1013e2acb3bf8f1b9d6d2acce3b742960","scope_sha256":"bbd8aad43e55220465624a8d2e4ce0d050a50446da4dc87e7680a98dd5e112f2","target_sha256":"34a04005bcaf206eec990bd9637d9fdb6725e0a0c0d4aebf003f17f4c956eb5c","transaction_sha256":"c595f44959327fd57e8636411587818b0c3c5a85a25b968c38f2d1ce69d63d3b"},"evidence_ref":"sha256:1ef25e9903cba97c3fd3cf1a6fbe20e9364a3d6d265e3ff4312d497fa3313251","issuer":"git-local","profile":{"id":"workcell.git-cas","version":"1beta1"},"profile_sha256":"124cfeff63ac91d1c776174e2bae7937672c68b0fde5dd703a746b7f05c5b569","schema":"dispatch.effect-assurance/v1beta1","subject":{"attempt_id":"1","effect_id":"effect-1","kind":"action","result_sha256":"7ec2a168c7602db8efca2733e2f7662100956ebe28f8551cddddfd9c898ec548","run_id":"run-1790561582791-4985","step_id":"action"},"validity":{"from":1790561580,"until":1790563382},"verification_method":"live_readback"}