{"bindings":{"key_sha256":"66e7c82b49bb291dd09c8e020448311c4a7bb96aeb5c5db769f66812b13a50b5","observed_state":"not_started","operation":"update","precondition_sha256":"7f6496c2d54a50a9e43da30bb3f03a9a750cfffc586644e92508f095ed0811c4","replay_class":"external_idempotent","reported_state":"unknown","request_sha256":"844fb8b97fba8184c639c9afbbbafcc1013e2acb3bf8f1b9d6d2acce3b742960","scope_sha256":"509ce5dae2c0a6880b6ce0b872fea0c64492bfbed8825702123366c91cff32d3","target_sha256":"34a04005bcaf206eec990bd9637d9fdb6725e0a0c0d4aebf003f17f4c956eb5c","transaction_sha256":"ef17c32b9cb5d0916ddab20da51b42be1766c4eefba7de73169894eb73be5df7"},"evidence_ref":"sha256:2cc1aedaf367e1cb0a716fe939d2073caf5b51d51c1ab6456a62fd301c968860","issuer":"git-local","profile":{"id":"workcell.git-cas","version":"1beta1"},"profile_sha256":"a5cb57430d0cc0af73a99185ef04400a31f26f2957645324baabd9d3fd1b058a","schema":"dispatch.effect-assurance/v1beta1","subject":{"attempt_id":"1","effect_id":"effect-1","kind":"action","result_sha256":"170525816e87f0b7da99cc195cd1c82b6518682262d92b7a76ba53d30a26430b","run_id":"run-1790557370802-6102","step_id":"action"},"validity":{"from":1790557368,"until":1790559170},"verification_method":"live_readback"}