{"bindings":{"key_sha256":"66e7c82b49bb291dd09c8e020448311c4a7bb96aeb5c5db769f66812b13a50b5","observed_state":"not_started","operation":"update","precondition_sha256":"7f6496c2d54a50a9e43da30bb3f03a9a750cfffc586644e92508f095ed0811c4","replay_class":"external_idempotent","reported_state":"unknown","request_sha256":"7ee5525debe0a643f4e43ba36c43e74cd965cff6363c8f994674c9a4f2db7a06","scope_sha256":"03b512b67ffba5e79f7b2ba28514374b7f7fd9d416f0a7c2e8797eb798380551","target_sha256":"1dd328912f177d086522657f8c4a48baf0ded4acef74ee979fdb261b11b7db30","transaction_sha256":"6e7fba8759d67caa39274ef75ed245f9ccc47cbd173b5d8fc343c7be0a3ea0bf"},"evidence_ref":"sha256:6c04ae9b59ea2894ce696d4be41a30ee65cfa237db06fc01231b761ef92039cf","issuer":"git-local","profile":{"id":"workcell.git-cas","version":"1beta1"},"profile_sha256":"611abcba79c46f79fa30b47b617bf36d0915e1866ad4e6010565290a55affba7","schema":"dispatch.effect-assurance/v1beta1","subject":{"attempt_id":"1","effect_id":"effect-1","kind":"action","result_sha256":"b01f62578aca6b081ee2ed0eafc60c7fc86066524ee8a8324b131cf385f6b3e3","run_id":"run-1790540247891-5074","step_id":"action"},"validity":{"from":1790540242,"until":1790542047},"verification_method":"live_readback"}