{"bindings":{"key_sha256":"f174b9cc33b1b0de9aa24421888e18fabf853139c5852c4920073afdcf0e3659","observed_state":"committed","operation":"create","precondition_sha256":"606f57ccfce33250527f1377dcb589e91654845d940000822e362a8938a88237","replay_class":"external_idempotent","reported_state":"unknown","request_sha256":"6900f68e4a395c65993f586a919eeb3bcc4d5d416c6f2096bbb42b62fdd720e8","scope_sha256":"6f875ea4144e49c9f71dbacd5aa84e70fa20e9c278bed00272b3d40476118d8b","target_sha256":"e76cee3b126634393b3a972c4ac277f8354bed0241a7590a3800fa12f43ff47f","transaction_sha256":"1edb4beb8b8d7beec904823c04577e8cc9d5ada67ff86f9b1eed61586f0e2270"},"evidence_ref":"sha256:343139db54d02c12c5e15c854c92faa8fa61a152c2430a8d3f4247a735b70d88","issuer":"ability-local","profile":{"id":"ability.application-gateway","version":"1beta1"},"profile_sha256":"f7825c4c7c55bdd4b5fc52be72340d768ee202aec45d002e565c3a88d43a6547","schema":"dispatch.effect-assurance/v1beta1","subject":{"attempt_id":"1","effect_id":"effect-1","kind":"action","result_sha256":"aeb55edca12eb4c71b329502f743c5f9bbfa246c939775f15dc956f908cca171","run_id":"run-1790540271988-7924","step_id":"action"},"validity":{"from":1790540269,"until":1790542071},"verification_method":"live_readback"}