{"bindings":{"key_sha256":"66e7c82b49bb291dd09c8e020448311c4a7bb96aeb5c5db769f66812b13a50b5","observed_state":"committed","operation":"update","precondition_sha256":"7f6496c2d54a50a9e43da30bb3f03a9a750cfffc586644e92508f095ed0811c4","replay_class":"external_idempotent","reported_state":"unknown","request_sha256":"844fb8b97fba8184c639c9afbbbafcc1013e2acb3bf8f1b9d6d2acce3b742960","scope_sha256":"ea20ccb05344e43bf0177ec64c5a7325631582bf36e9a20b844ae2b9950ca4de","target_sha256":"34a04005bcaf206eec990bd9637d9fdb6725e0a0c0d4aebf003f17f4c956eb5c","transaction_sha256":"5677610f24e71ec0016b426b1dc11cf5039e2ac81e380132a31b37ced73b4d01"},"evidence_ref":"sha256:933055fc892e1941ae26bcee91f192243a28e53cf73ced0e57002352cfd0a464","issuer":"git-local","profile":{"id":"workcell.git-cas","version":"1beta1"},"profile_sha256":"12eebe206fc23879218a1f88d28b659d351a90d03d8276f3fabf1bb9b08b1957","schema":"dispatch.effect-assurance/v1beta1","subject":{"attempt_id":"1","effect_id":"effect-1","kind":"action","result_sha256":"20cf28d04e38232afa7c88077ed1c404903884698880bfa2da8d94f010a37438","run_id":"run-1790557382461-6724","step_id":"action"},"validity":{"from":1790557379,"until":1790559181},"verification_method":"live_readback"}