{"bindings":{"key_sha256":"66e7c82b49bb291dd09c8e020448311c4a7bb96aeb5c5db769f66812b13a50b5","observed_state":"not_started","operation":"update","precondition_sha256":"7f6496c2d54a50a9e43da30bb3f03a9a750cfffc586644e92508f095ed0811c4","replay_class":"external_idempotent","reported_state":"unknown","request_sha256":"0bd4eb5cf3393daa35f5a1f6a1878da05df7b47a52f67896b52070a2210e4a72","scope_sha256":"03b512b67ffba5e79f7b2ba28514374b7f7fd9d416f0a7c2e8797eb798380551","target_sha256":"b44d0cd8336a21e52ace1d2c1ea8b30db8ab7febec342c0751663a7d4aebed29","transaction_sha256":"29f15b95420f31b89231abf5d301f5fa05a7f8670aa9fb2b1409a9c5394235c5"},"evidence_ref":"sha256:2de79da42f4625176f5c6a24a86696ed99154d09e3032a83f0ff59c975a597f9","issuer":"git-local","profile":{"id":"workcell.git-cas","version":"1beta1"},"profile_sha256":"96aafe6d1e9b3b66db0071b68362f8f233d7db93a627c3fc1a6fda9143be5080","schema":"dispatch.effect-assurance/v1beta1","subject":{"attempt_id":"1","effect_id":"effect-1","kind":"action","result_sha256":"fdd1d592a737045b40251e47a572bb18bb3563f7ea11709930e60f6ec14cbdab","run_id":"run-1790561642782-7112","step_id":"action"},"validity":{"from":1790561637,"until":1790563442},"verification_method":"live_readback"}