{"bindings":{"key_sha256":"66e7c82b49bb291dd09c8e020448311c4a7bb96aeb5c5db769f66812b13a50b5","observed_state":"not_started","operation":"update","precondition_sha256":"7f6496c2d54a50a9e43da30bb3f03a9a750cfffc586644e92508f095ed0811c4","replay_class":"external_idempotent","reported_state":"unknown","request_sha256":"844fb8b97fba8184c639c9afbbbafcc1013e2acb3bf8f1b9d6d2acce3b742960","scope_sha256":"78065f580db2fdf8786a55728fbce0de1cf6446f742b2f3fecc930abd76f8865","target_sha256":"34a04005bcaf206eec990bd9637d9fdb6725e0a0c0d4aebf003f17f4c956eb5c","transaction_sha256":"74fb7369e5c9899107f5f2e0359e034b6f7a5ab0aa2ee91799f48c835a179623"},"evidence_ref":"sha256:11df217ea56086d6c9b44867b4e4b12e839faaf5b1b6fbcdc1a6543816c92608","issuer":"git-local","profile":{"id":"workcell.git-cas","version":"1beta1"},"profile_sha256":"1a3e9ea4dbc0abdd239947571183fe29f677f1709c21a6f5443065576abbdd0e","schema":"dispatch.effect-assurance/v1beta1","subject":{"attempt_id":"1","effect_id":"effect-1","kind":"action","result_sha256":"16b5141d711d2164e50e913a19e9270a972689c2a3d982610fe290f60fa4f06a","run_id":"run-1790561571067-5411","step_id":"action"},"validity":{"from":1790561568,"until":1790563370},"verification_method":"live_readback"}