{"bindings":{"key_sha256":"5f582b3b728b6ff9be9354e955d366756c5f5b3857541b33c097b872aff87d6a","observed_state":"committed","operation":"create","precondition_sha256":"d3740fe71ba4de6a7da1253164ca5baae805b24b15ef2249e60bd24e41e97d3b","replay_class":"external_idempotent","reported_state":"unknown","request_sha256":"6ac2d8b60b9ddd445abd6ac61bb894bd45186b7bc13b34facc1415f902b01c5f","scope_sha256":"4f1a3c54c632c0858a326a31ddf248c7ac220c7eb428adbd99fad136fd63bbd5","target_sha256":"e76cee3b126634393b3a972c4ac277f8354bed0241a7590a3800fa12f43ff47f","transaction_sha256":"32a720413061357e2ecff8060a8358696c47ae16c8b255a952a39b5dcf3fd7c6"},"evidence_ref":"sha256:358955e26e13521d7c5a4fbe653b99c2129e8d3bbdfab300cc8a5340d996839a","issuer":"ability-local","profile":{"id":"ability.application-gateway","version":"1beta1"},"profile_sha256":"ec33966c117bc3ea1524016931d6dd49b2266bfcfcc78c7756799b4e25d05643","schema":"dispatch.effect-assurance/v1beta1","subject":{"attempt_id":"1","effect_id":"effect-1","kind":"action","result_sha256":"3276490a4784ffcad186c5063f5a033cca5947dd6efeda9c3586949fe7143d41","run_id":"run-1790540380896-5891","step_id":"action"},"validity":{"from":1790540378,"until":1790542180},"verification_method":"live_readback"}